<?xml version="1.0"?>
<!--
/**
 * Copyright Â© 2015 Magento. All rights reserved.
 * See COPYING.txt for license details.
 */
-->
<config xmlns:xsi="http://www.w3.org/2001/XMLSchema-instance" xsi:noNamespaceSchemaLocation="urn:magento:framework:ObjectManager/etc/config.xsd">
    <virtualType name="Magento\Checkout\Model\Session\Storage" type="Magento\Framework\Session\Storage">
        <arguments>
            <argument name="namespace" xsi:type="string">checkout</argument>
        </arguments>
    </virtualType>
    <type name="Magento\Checkout\Model\Session">
        <arguments>
            <argument name="storage" xsi:type="object">Magento\Checkout\Model\Session\Storage</argument>
        </arguments>
    </type>
    <preference for="Magento\Checkout\Api\GuestShippingInformationManagementInterface" type="Magento\Checkout\Model\GuestShippingInformationManagement" />
    <preference for="Magento\Checkout\Api\ShippingInformationManagementInterface" type="Magento\Checkout\Model\ShippingInformationManagement" />
    <preference for="Magento\Checkout\Api\Data\ShippingInformationInterface" type="Magento\Checkout\Model\ShippingInformation" />
    <preference for="Magento\Checkout\Api\Data\PaymentDetailsInterface" type="Magento\Checkout\Model\PaymentDetails" />
    <preference for="Magento\Checkout\Api\GuestPaymentInformationManagementInterface" type="Magento\Checkout\Model\GuestPaymentInformationManagement" />
    <preference for="Magento\Checkout\Api\PaymentInformationManagementInterface" type="Magento\Checkout\Model\PaymentInformationManagement" />
    <preference for="Magento\Checkout\Api\Data\TotalsInformationInterface" type="Magento\Checkout\Model\TotalsInformation" />
    <preference for="Magento\Checkout\Api\GuestTotalsInformationManagementInterface" type="Magento\Checkout\Model\GuestTotalsInformationManagement" />
    <preference for="Magento\Checkout\Api\TotalsInformationManagementInterface" type="Magento\Checkout\Model\TotalsInformationManagement" />
    <preference for="Magento\Checkout\Api\AgreementsValidatorInterface" type="Magento\Checkout\Model\AgreementsValidator" />
</config>
